root@lamp-ubuntu-s-1vcpu-1gb-tor1-01:~# tcpdump -n -i eth0
tcpdump: verbose output suppressed, use -v[v]... for full protocol decode
listening on eth0, link-type EN10MB (Ethernet), snapshot length 262144 bytes
20:19:17.935772 IP 178.128.236.45.22 > 99.228.153.224.50332: Flags [P.], seq 3649076303:3649076387, ack 704802797, win 501, length 84
20:19:17.936497 IP 178.128.236.45.22 > 99.228.153.224.50332: Flags [P.], seq 84:192, ack 1, win 501, length 108
20:19:17.936543 IP 178.128.236.45.22 > 99.228.153.224.50332: Flags [P.], seq 192:228, ack 1, win 501, length 36
20:19:17.936576 IP 178.128.236.45.22 > 99.228.153.224.50332: Flags [P.], seq 228:280, ack 1, win 501, length 52
20:19:17.936607 IP 178.128.236.45.22 > 99.228.153.224.50332: Flags [P.], seq 280:348, ack 1, win 501, length 68
20:19:17.936637 IP 178.128.236.45.22 > 99.228.153.224.50332: Flags [P.], seq 348:416, ack 1, win 501, length 68
20:19:17.936664 IP 178.128.236.45.22 > 99.228.153.224.50332: Flags [P.], seq 416:452, ack 1, win 501, length 36
20:19:17.948683 IP 99.228.153.224.50332 > 178.128.236.45.22: Flags [.], ack 452, win 4106, length 0
20:19:18.035089 IP 178.128.236.45.22 > 99.228.153.224.50332: Flags [P.], seq 452:624, ack 1, win 501, length 172
20:19:18.035171 IP 178.128.236.45.22 > 99.228.153.224.50332: Flags [P.], seq 624:660, ack 1, win 501, length 36
20:19:18.035261 IP 178.128.236.45.22 > 99.228.153.224.50332: Flags [P.], seq 660:808, ack 1, win 501, length 148
20:19:18.035305 IP 178.128.236.45.22 > 99.228.153.224.50332: Flags [P.], seq 808:844, ack 1, win 501, length 36
20:19:18.035366 IP 178.128.236.45.22 > 99.228.153.224.50332: Flags [P.], seq 844:992, ack 1, win 501, length 148
20:19:18.035398 IP 178.128.236.45.22 > 99.228.153.224.50332: Flags [P.], seq 992:1028, ack 1, win 501, length 36
20:19:18.035503 IP 178.128.236.45.22 > 99.228.153.224.50332: Flags [P.], seq 1028:1176, ack 1, win 501, length 148
20:19:18.035531 IP 178.128.236.45.22 > 99.228.153.224.50332: Flags [P.], seq 1176:1212, ack 1, win 501, length 36
20:19:18.035567 IP 178.128.236.45.22 > 99.228.153.224.50332: Flags [P.], seq 1212:1360, ack 1, win 501, length 148
20:19:18.035594 IP 178.128.236.45.22 > 99.228.153.224.50332: Flags [P.], seq 1360:1396, ack 1, win 501, length 36
20:19:18.035644 IP 178.128.236.45.22 > 99.228.153.224.50332: Flags [P.], seq 1396:1544, ack 1, win 501, length 148
20:19:18.035688 IP 178.128.236.45.22 > 99.228.153.224.50332: Flags [P.], seq 1544:1580, ack 1, win 501, length 36
20:19:18.035722 IP 178.128.236.45.22 > 99.228.153.224.50332: Flags [P.], seq 1580:1728, ack 1, win 501, length 148
20:19:18.035748 IP 178.128.236.45.22 > 99.228.153.224.50332: Flags [P.], seq 1728:1764, ack 1, win 501, length 36
20:19:18.035783 IP 178.128.236.45.22 > 99.228.153.224.50332: Flags [P.], seq 1764:1904, ack 1, win 501, length 140
20:19:18.035812 IP 178.128.236.45.22 > 99.228.153.224.50332: Flags [P.], seq 1904:1940, ack 1, win 501, length 36
20:19:18.052982 IP 99.228.153.224.50332 > 178.128.236.45.22: Flags [.], ack 1940, win 4106, length 0
20:19:18.138977 IP 178.128.236.45.22 > 99.228.153.224.50332: Flags [P.], seq 1940:2088, ack 1, win 501, length 148
20:19:18.139044 IP 178.128.236.45.22 > 99.228.153.224.50332: Flags [P.], seq 2088:2124, ack 1, win 501, length 36
20:19:18.139105 IP 178.128.236.45.22 > 99.228.153.224.50332: Flags [P.], seq 2124:2272, ack 1, win 501, length 148
20:19:18.139133 IP 178.128.236.45.22 > 99.228.153.224.50332: Flags [P.], seq 2272:2308, ack 1, win 501, length 36
20:19:18.139169 IP 178.128.236.45.22 > 99.228.153.224.50332: Flags [P.], seq 2308:2456, ack 1, win 501, length 148
20:19:18.139196 IP 178.128.236.45.22 > 99.228.153.224.50332: Flags [P.], seq 2456:2492, ack 1, win 501, length 36
20:19:18.139232 IP 178.128.236.45.22 > 99.228.153.224.50332: Flags [P.], seq 2492:2640, ack 1, win 501, length 148
20:19:18.139259 IP 178.128.236.45.22 > 99.228.153.224.50332: Flags [P.], seq 2640:2676, ack 1, win 501, length 36
20:19:18.139299 IP 178.128.236.45.22 > 99.228.153.224.50332: Flags [P.], seq 2676:2824, ack 1, win 501, length 148
20:19:18.139330 IP 178.128.236.45.22 > 99.228.153.224.50332: Flags [P.], seq 2824:2860, ack 1, win 501, length 36
20:19:18.139368 IP 178.128.236.45.22 > 99.228.153.224.50332: Flags [P.], seq 2860:3008, ack 1, win 501, length 148
20:19:18.139404 IP 178.128.236.45.22 > 99.228.153.224.50332: Flags [P.], seq 3008:3044, ack 1, win 501, length 36
20:19:18.139446 IP 178.128.236.45.22 > 99.228.153.224.50332: Flags [P.], seq 3044:3192, ack 1, win 501, length 148
20:19:18.139478 IP 178.128.236.45.22 > 99.228.153.224.50332: Flags [P.], seq 3192:3228, ack 1, win 501, length 36
20:19:18.139530 IP 178.128.236.45.22 > 99.228.153.224.50332: Flags [P.], seq 3228:3376, ack 1, win 501, length 148
20:19:18.139560 IP 178.128.236.45.22 > 99.228.153.224.50332: Flags [P.], seq 3376:3412, ack 1, win 501, length 36
20:19:18.139599 IP 178.128.236.45.22 > 99.228.153.224.50332: Flags [P.], seq 3412:3560, ack 1, win 501, length 148
20:19:18.139627 IP 178.128.236.45.22 > 99.228.153.224.50332: Flags [P.], seq 3560:3596, ack 1, win 501, length 36
20:19:18.139680 IP 178.128.236.45.22 > 99.228.153.224.50332: Flags [P.], seq 3596:3744, ack 1, win 501, length 148
20:19:18.139717 IP 178.128.236.45.22 > 99.228.153.224.50332: Flags [P.], seq 3744:3780, ack 1, win 501, length 36
20:19:18.139770 IP 178.128.236.45.22 > 99.228.153.224.50332: Flags [P.], seq 3780:3928, ack 1, win 501, length 148
20:19:18.139804 IP 178.128.236.45.22 > 99.228.153.224.50332: Flags [P.], seq 3928:3964, ack 1, win 501, length 36
20:19:18.139855 IP 178.128.236.45.22 > 99.228.153.224.50332: Flags [P.], seq 3964:4112, ack 1, win 501, length 148
20:19:18.139917 IP 178.128.236.45.22 > 99.228.153.224.50332: Flags [P.], seq 4112:4148, ack 1, win 501, length 36
20:19:18.139975 IP 178.128.236.45.22 > 99.228.153.224.50332: Flags [P.], seq 4148:4296, ack 1, win 501, length 148
20:19:18.140004 IP 178.128.236.45.22 > 99.228.153.224.50332: Flags [P.], seq 4296:4332, ack 1, win 501, length 36
20:19:18.140041 IP 178.128.236.45.22 > 99.228.153.224.50332: Flags [P.], seq 4332:4480, ack 1, win 501, length 148
20:19:18.140068 IP 178.128.236.45.22 > 99.228.153.224.50332: Flags [P.], seq 4480:4516, ack 1, win 501, length 36
20:19:18.140104 IP 178.128.236.45.22 > 99.228.153.224.50332: Flags [P.], seq 4516:4664, ack 1, win 501, length 148
20:19:18.140156 IP 178.128.236.45.22 > 99.228.153.224.50332: Flags [P.], seq 4664:4848, ack 1, win 501, length 184
20:19:18.140183 IP 178.128.236.45.22 > 99.228.153.224.50332: Flags [P.], seq 4848:4884, ack 1, win 501, length 36
20:19:18.140236 IP 178.128.236.45.22 > 99.228.153.224.50332: Flags [P.], seq 4884:5024, ack 1, win 501, length 140
20:19:18.140274 IP 178.128.236.45.22 > 99.228.153.224.50332: Flags [P.], seq 5024:5060, ack 1, win 501, length 36
20:19:18.153461 IP 99.228.153.224.50332 > 178.128.236.45.22: Flags [.], ack 5024, win 4106, length 0
20:19:18.196605 IP 99.228.153.224.50332 > 178.128.236.45.22: Flags [.], ack 5060, win 4106, length 0
20:19:18.242903 IP 178.128.236.45.22 > 99.228.153.224.50332: Flags [P.], seq 5060:5208, ack 1, win 501, length 148
20:19:18.243080 IP 178.128.236.45.22 > 99.228.153.224.50332: Flags [P.], seq 5208:5244, ack 1, win 501, length 36
20:19:18.243147 IP 178.128.236.45.22 > 99.228.153.224.50332: Flags [P.], seq 5244:5392, ack 1, win 501, length 148
20:19:18.243173 IP 178.128.236.45.22 > 99.228.153.224.50332: Flags [P.], seq 5392:5428, ack 1, win 501, length 36
20:19:18.243209 IP 178.128.236.45.22 > 99.228.153.224.50332: Flags [P.], seq 5428:5576, ack 1, win 501, length 148
20:19:18.243235 IP 178.128.236.45.22 > 99.228.153.224.50332: Flags [P.], seq 5576:5612, ack 1, win 501, length 36
20:19:18.243269 IP 178.128.236.45.22 > 99.228.153.224.50332: Flags [P.], seq 5612:5760, ack 1, win 501, length 148
20:19:18.243295 IP 178.128.236.45.22 > 99.228.153.224.50332: Flags [P.], seq 5760:5796, ack 1, win 501, length 36
20:19:18.243334 IP 178.128.236.45.22 > 99.228.153.224.50332: Flags [P.], seq 5796:5944, ack 1, win 501, length 148
20:19:18.243372 IP 178.128.236.45.22 > 99.228.153.224.50332: Flags [P.], seq 5944:5980, ack 1, win 501, length 36
20:19:18.243415 IP 178.128.236.45.22 > 99.228.153.224.50332: Flags [P.], seq 5980:6128, ack 1, win 501, length 148
20:19:18.243442 IP 178.128.236.45.22 > 99.228.153.224.50332: Flags [P.], seq 6128:6164, ack 1, win 501, length 36
20:19:18.243477 IP 178.128.236.45.22 > 99.228.153.224.50332: Flags [P.], seq 6164:6312, ack 1, win 501, length 148
20:19:18.243502 IP 178.128.236.45.22 > 99.228.153.224.50332: Flags [P.], seq 6312:6348, ack 1, win 501, length 36
20:19:18.243539 IP 178.128.236.45.22 > 99.228.153.224.50332: Flags [P.], seq 6348:6496, ack 1, win 501, length 148
20:19:18.243564 IP 178.128.236.45.22 > 99.228.153.224.50332: Flags [P.], seq 6496:6532, ack 1, win 501, length 36
20:19:18.243620 IP 178.128.236.45.22 > 99.228.153.224.50332: Flags [P.], seq 6532:6680, ack 1, win 501, length 148
20:19:18.243654 IP 178.128.236.45.22 > 99.228.153.224.50332: Flags [P.], seq 6680:6716, ack 1, win 501, length 36
20:19:18.243692 IP 178.128.236.45.22 > 99.228.153.224.50332: Flags [P.], seq 6716:6864, ack 1, win 501, length 148
20:19:18.243725 IP 178.128.236.45.22 > 99.228.153.224.50332: Flags [P.], seq 6864:6900, ack 1, win 501, length 36
20:19:18.243762 IP 178.128.236.45.22 > 99.228.153.224.50332: Flags [P.], seq 6900:7048, ack 1, win 501, length 148
20:19:18.243788 IP 178.128.236.45.22 > 99.228.153.224.50332: Flags [P.], seq 7048:7084, ack 1, win 501, length 36
20:19:18.243822 IP 178.128.236.45.22 > 99.228.153.224.50332: Flags [P.], seq 7084:7232, ack 1, win 501, length 148
20:19:18.243848 IP 178.128.236.45.22 > 99.228.153.224.50332: Flags [P.], seq 7232:7268, ack 1, win 501, length 36
20:19:18.243883 IP 178.128.236.45.22 > 99.228.153.224.50332: Flags [P.], seq 7268:7416, ack 1, win 501, length 148
20:19:18.243910 IP 178.128.236.45.22 > 99.228.153.224.50332: Flags [P.], seq 7416:7452, ack 1, win 501, length 36
20:19:18.243944 IP 178.128.236.45.22 > 99.228.153.224.50332: Flags [P.], seq 7452:7600, ack 1, win 501, length 148
20:19:18.243970 IP 178.128.236.45.22 > 99.228.153.224.50332: Flags [P.], seq 7600:7636, ack 1, win 501, length 36
20:19:18.244005 IP 178.128.236.45.22 > 99.228.153.224.50332: Flags [P.], seq 7636:7784, ack 1, win 501, length 148
20:19:18.244030 IP 178.128.236.45.22 > 99.228.153.224.50332: Flags [P.], seq 7784:7820, ack 1, win 501, length 36
20:19:18.244065 IP 178.128.236.45.22 > 99.228.153.224.50332: Flags [P.], seq 7820:7968, ack 1, win 501, length 148
20:19:18.244091 IP 178.128.236.45.22 > 99.228.153.224.50332: Flags [P.], seq 7968:8004, ack 1, win 501, length 36
20:19:18.244126 IP 178.128.236.45.22 > 99.228.153.224.50332: Flags [P.], seq 8004:8152, ack 1, win 501, length 148
20:19:18.244152 IP 178.128.236.45.22 > 99.228.153.224.50332: Flags [P.], seq 8152:8188, ack 1, win 501, length 36
20:19:18.244189 IP 178.128.236.45.22 > 99.228.153.224.50332: Flags [P.], seq 8188:8336, ack 1, win 501, length 148
20:19:18.244231 IP 178.128.236.45.22 > 99.228.153.224.50332: Flags [P.], seq 8336:8372, ack 1, win 501, length 36
20:19:18.244283 IP 178.128.236.45.22 > 99.228.153.224.50332: Flags [P.], seq 8372:8520, ack 1, win 501, length 148
20:19:18.244314 IP 178.128.236.45.22 > 99.228.153.224.50332: Flags [P.], seq 8520:8556, ack 1, win 501, length 36
20:19:18.244351 IP 178.128.236.45.22 > 99.228.153.224.50332: Flags [P.], seq 8556:8704, ack 1, win 501, length 148
20:19:18.244387 IP 178.128.236.45.22 > 99.228.153.224.50332: Flags [P.], seq 8704:8740, ack 1, win 501, length 36
20:19:18.244423 IP 178.128.236.45.22 > 99.228.153.224.50332: Flags [P.], seq 8740:8888, ack 1, win 501, length 148
20:19:18.244451 IP 178.128.236.45.22 > 99.228.153.224.50332: Flags [P.], seq 8888:8924, ack 1, win 501, length 36
20:19:18.244486 IP 178.128.236.45.22 > 99.228.153.224.50332: Flags [P.], seq 8924:9072, ack 1, win 501, length 148
20:19:18.244543 IP 178.128.236.45.22 > 99.228.153.224.50332: Flags [P.], seq 9072:9108, ack 1, win 501, length 36
20:19:18.244592 IP 178.128.236.45.22 > 99.228.153.224.50332: Flags [P.], seq 9108:9256, ack 1, win 501, length 148
20:19:18.244635 IP 178.128.236.45.22 > 99.228.153.224.50332: Flags [P.], seq 9256:9292, ack 1, win 501, length 36
20:19:18.244678 IP 178.128.236.45.22 > 99.228.153.224.50332: Flags [P.], seq 9292:9440, ack 1, win 501, length 148
20:19:18.244710 IP 178.128.236.45.22 > 99.228.153.224.50332: Flags [P.], seq 9440:9476, ack 1, win 501, length 36
20:19:18.244754 IP 178.128.236.45.22 > 99.228.153.224.50332: Flags [P.], seq 9476:9624, ack 1, win 501, length 148
20:19:18.244780 IP 178.128.236.45.22 > 99.228.153.224.50332: Flags [P.], seq 9624:9660, ack 1, win 501, length 36
20:19:18.244815 IP 178.128.236.45.22 > 99.228.153.224.50332: Flags [P.], seq 9660:9808, ack 1, win 501, length 148
20:19:18.244842 IP 178.128.236.45.22 > 99.228.153.224.50332: Flags [P.], seq 9808:9844, ack 1, win 501, length 36
20:19:18.244877 IP 178.128.236.45.22 > 99.228.153.224.50332: Flags [P.], seq 9844:9992, ack 1, win 501, length 148
20:19:18.244903 IP 178.128.236.45.22 > 99.228.153.224.50332: Flags [P.], seq 9992:10028, ack 1, win 501, length 36
20:19:18.244937 IP 178.128.236.45.22 > 99.228.153.224.50332: Flags [P.], seq 10028:10176, ack 1, win 501, length 148
20:19:18.244963 IP 178.128.236.45.22 > 99.228.153.224.50332: Flags [P.], seq 10176:10212, ack 1, win 501, length 36
20:19:18.244999 IP 178.128.236.45.22 > 99.228.153.224.50332: Flags [P.], seq 10212:10360, ack 1, win 501, length 148
20:19:18.245026 IP 178.128.236.45.22 > 99.228.153.224.50332: Flags [P.], seq 10360:10396, ack 1, win 501, length 36
20:19:18.245060 IP 178.128.236.45.22 > 99.228.153.224.50332: Flags [P.], seq 10396:10544, ack 1, win 501, length 148
20:19:18.245086 IP 178.128.236.45.22 > 99.228.153.224.50332: Flags [P.], seq 10544:10580, ack 1, win 501, length 36
20:19:18.245121 IP 178.128.236.45.22 > 99.228.153.224.50332: Flags [P.], seq 10580:10728, ack 1, win 501, length 148
20:19:18.245147 IP 178.128.236.45.22 > 99.228.153.224.50332: Flags [P.], seq 10728:10764, ack 1, win 501, length 36
20:19:18.245180 IP 178.128.236.45.22 > 99.228.153.224.50332: Flags [P.], seq 10764:10912, ack 1, win 501, length 148
20:19:18.245206 IP 178.128.236.45.22 > 99.228.153.224.50332: Flags [P.], seq 10912:10948, ack 1, win 501, length 36
20:19:18.245241 IP 178.128.236.45.22 > 99.228.153.224.50332: Flags [P.], seq 10948:11096, ack 1, win 501, length 148
20:19:18.245268 IP 178.128.236.45.22 > 99.228.153.224.50332: Flags [P.], seq 11096:11132, ack 1, win 501, length 36
20:19:18.263544 IP 99.228.153.224.50332 > 178.128.236.45.22: Flags [.], ack 8004, win 4106, length 0
20:19:18.263544 IP 99.228.153.224.50332 > 178.128.236.45.22: Flags [.], ack 11132, win 4106, length 0
20:19:18.263618 IP 178.128.236.45.22 > 99.228.153.224.50332: Flags [P.], seq 11132:11484, ack 1, win 501, length 352
20:19:18.316017 IP 99.228.153.224.50332 > 178.128.236.45.22: Flags [.], ack 11484, win 4104, length 0
20:19:18.346974 IP 178.128.236.45.22 > 99.228.153.224.50332: Flags [P.], seq 11484:11632, ack 1, win 501, length 148
20:19:18.347047 IP 178.128.236.45.22 > 99.228.153.224.50332: Flags [P.], seq 11632:11668, ack 1, win 501, length 36
20:19:18.347109 IP 178.128.236.45.22 > 99.228.153.224.50332: Flags [P.], seq 11668:11816, ack 1, win 501, length 148
20:19:18.347137 IP 178.128.236.45.22 > 99.228.153.224.50332: Flags [P.], seq 11816:11852, ack 1, win 501, length 36
20:19:18.347174 IP 178.128.236.45.22 > 99.228.153.224.50332: Flags [P.], seq 11852:12000, ack 1, win 501, length 148
20:19:18.347200 IP 178.128.236.45.22 > 99.228.153.224.50332: Flags [P.], seq 12000:12036, ack 1, win 501, length 36
20:19:18.347235 IP 178.128.236.45.22 > 99.228.153.224.50332: Flags [P.], seq 12036:12184, ack 1, win 501, length 148
20:19:18.347262 IP 178.128.236.45.22 > 99.228.153.224.50332: Flags [P.], seq 12184:12220, ack 1, win 501, length 36
20:19:18.347297 IP 178.128.236.45.22 > 99.228.153.224.50332: Flags [P.], seq 12220:12368, ack 1, win 501, length 148
20:19:18.347323 IP 178.128.236.45.22 > 99.228.153.224.50332: Flags [P.], seq 12368:12404, ack 1, win 501, length 36
20:19:18.347361 IP 178.128.236.45.22 > 99.228.153.224.50332: Flags [P.], seq 12404:12552, ack 1, win 501, length 148
20:19:18.347393 IP 178.128.236.45.22 > 99.228.153.224.50332: Flags [P.], seq 12552:12588, ack 1, win 501, length 36
20:19:18.347434 IP 178.128.236.45.22 > 99.228.153.224.50332: Flags [P.], seq 12588:12736, ack 1, win 501, length 148
20:19:18.347473 IP 178.128.236.45.22 > 99.228.153.224.50332: Flags [P.], seq 12736:12772, ack 1, win 501, length 36
20:19:18.347533 IP 178.128.236.45.22 > 99.228.153.224.50332: Flags [P.], seq 12772:12920, ack 1, win 501, length 148
20:19:18.347569 IP 178.128.236.45.22 > 99.228.153.224.50332: Flags [P.], seq 12920:12956, ack 1, win 501, length 36
20:19:18.347618 IP 178.128.236.45.22 > 99.228.153.224.50332: Flags [P.], seq 12956:13104, ack 1, win 501, length 148
20:19:18.347645 IP 178.128.236.45.22 > 99.228.153.224.50332: Flags [P.], seq 13104:13140, ack 1, win 501, length 36
20:19:18.347683 IP 178.128.236.45.22 > 99.228.153.224.50332: Flags [P.], seq 13140:13288, ack 1, win 501, length 148
20:19:18.347710 IP 178.128.236.45.22 > 99.228.153.224.50332: Flags [P.], seq 13288:13324, ack 1, win 501, length 36
20:19:18.347763 IP 178.128.236.45.22 > 99.228.153.224.50332: Flags [P.], seq 13324:13472, ack 1, win 501, length 148
20:19:18.347796 IP 178.128.236.45.22 > 99.228.153.224.50332: Flags [P.], seq 13472:13508, ack 1, win 501, length 36
20:19:18.347834 IP 178.128.236.45.22 > 99.228.153.224.50332: Flags [P.], seq 13508:13656, ack 1, win 501, length 148
20:19:18.347860 IP 178.128.236.45.22 > 99.228.153.224.50332: Flags [P.], seq 13656:13692, ack 1, win 501, length 36
20:19:18.347895 IP 178.128.236.45.22 > 99.228.153.224.50332: Flags [P.], seq 13692:13840, ack 1, win 501, length 148
20:19:18.347922 IP 178.128.236.45.22 > 99.228.153.224.50332: Flags [P.], seq 13840:13876, ack 1, win 501, length 36
20:19:18.347956 IP 178.128.236.45.22 > 99.228.153.224.50332: Flags [P.], seq 13876:14024, ack 1, win 501, length 148
20:19:18.347988 IP 178.128.236.45.22 > 99.228.153.224.50332: Flags [P.], seq 14024:14060, ack 1, win 501, length 36
20:19:18.348022 IP 178.128.236.45.22 > 99.228.153.224.50332: Flags [P.], seq 14060:14208, ack 1, win 501, length 148
20:19:18.348048 IP 178.128.236.45.22 > 99.228.153.224.50332: Flags [P.], seq 14208:14244, ack 1, win 501, length 36
20:19:18.348083 IP 178.128.236.45.22 > 99.228.153.224.50332: Flags [P.], seq 14244:14392, ack 1, win 501, length 148
20:19:18.348109 IP 178.128.236.45.22 > 99.228.153.224.50332: Flags [P.], seq 14392:14428, ack 1, win 501, length 36
20:19:18.348149 IP 178.128.236.45.22 > 99.228.153.224.50332: Flags [P.], seq 14428:14576, ack 1, win 501, length 148
20:19:18.348176 IP 178.128.236.45.22 > 99.228.153.224.50332: Flags [P.], seq 14576:14612, ack 1, win 501, length 36
20:19:18.348215 IP 178.128.236.45.22 > 99.228.153.224.50332: Flags [P.], seq 14612:14760, ack 1, win 501, length 148
20:19:18.348253 IP 178.128.236.45.22 > 99.228.153.224.50332: Flags [P.], seq 14760:14796, ack 1, win 501, length 36
20:19:18.348295 IP 178.128.236.45.22 > 99.228.153.224.50332: Flags [P.], seq 14796:14944, ack 1, win 501, length 148
20:19:18.348331 IP 178.128.236.45.22 > 99.228.153.224.50332: Flags [P.], seq 14944:14980, ack 1, win 501, length 36
20:19:18.348385 IP 178.128.236.45.22 > 99.228.153.224.50332: Flags [P.], seq 14980:15128, ack 1, win 501, length 148
20:19:18.348412 IP 178.128.236.45.22 > 99.228.153.224.50332: Flags [P.], seq 15128:15164, ack 1, win 501, length 36
20:19:18.348459 IP 178.128.236.45.22 > 99.228.153.224.50332: Flags [P.], seq 15164:15312, ack 1, win 501, length 148
20:19:18.348485 IP 178.128.236.45.22 > 99.228.153.224.50332: Flags [P.], seq 15312:15348, ack 1, win 501, length 36
20:19:18.348526 IP 178.128.236.45.22 > 99.228.153.224.50332: Flags [P.], seq 15348:15496, ack 1, win 501, length 148
20:19:18.348557 IP 178.128.236.45.22 > 99.228.153.224.50332: Flags [P.], seq 15496:15532, ack 1, win 501, length 36
20:19:18.348592 IP 178.128.236.45.22 > 99.228.153.224.50332: Flags [P.], seq 15532:15680, ack 1, win 501, length 148
20:19:18.348619 IP 178.128.236.45.22 > 99.228.153.224.50332: Flags [P.], seq 15680:15716, ack 1, win 501, length 36
20:19:18.348654 IP 178.128.236.45.22 > 99.228.153.224.50332: Flags [P.], seq 15716:15864, ack 1, win 501, length 148
20:19:18.348719 IP 178.128.236.45.22 > 99.228.153.224.50332: Flags [P.], seq 15864:15900, ack 1, win 501, length 36
20:19:18.348818 IP 178.128.236.45.22 > 99.228.153.224.50332: Flags [P.], seq 15900:16048, ack 1, win 501, length 148
20:19:18.348850 IP 178.128.236.45.22 > 99.228.153.224.50332: Flags [P.], seq 16048:16084, ack 1, win 501, length 36
20:19:18.348893 IP 178.128.236.45.22 > 99.228.153.224.50332: Flags [P.], seq 16084:16232, ack 1, win 501, length 148
20:19:18.348921 IP 178.128.236.45.22 > 99.228.153.224.50332: Flags [P.], seq 16232:16268, ack 1, win 501, length 36
20:19:18.348965 IP 178.128.236.45.22 > 99.228.153.224.50332: Flags [P.], seq 16268:16416, ack 1, win 501, length 148
20:19:18.349017 IP 178.128.236.45.22 > 99.228.153.224.50332: Flags [P.], seq 16416:16452, ack 1, win 501, length 36
20:19:18.349041 IP 178.128.236.45.22 > 99.228.153.224.50332: Flags [P.], seq 16452:16600, ack 1, win 501, length 148
20:19:18.349076 IP 178.128.236.45.22 > 99.228.153.224.50332: Flags [P.], seq 16600:16636, ack 1, win 501, length 36
20:19:18.349126 IP 178.128.236.45.22 > 99.228.153.224.50332: Flags [P.], seq 16636:16784, ack 1, win 501, length 148
20:19:18.349165 IP 178.128.236.45.22 > 99.228.153.224.50332: Flags [P.], seq 16784:16820, ack 1, win 501, length 36
20:19:18.349206 IP 178.128.236.45.22 > 99.228.153.224.50332: Flags [P.], seq 16820:16968, ack 1, win 501, length 148
20:19:18.349242 IP 178.128.236.45.22 > 99.228.153.224.50332: Flags [P.], seq 16968:17004, ack 1, win 501, length 36
20:19:18.349272 IP 178.128.236.45.22 > 99.228.153.224.50332: Flags [P.], seq 17004:17152, ack 1, win 501, length 148
20:19:18.349315 IP 178.128.236.45.22 > 99.228.153.224.50332: Flags [P.], seq 17152:17308, ack 1, win 501, length 156
20:19:18.349365 IP 178.128.236.45.22 > 99.228.153.224.50332: Flags [P.], seq 17308:17576, ack 1, win 501, length 268
20:19:18.349414 IP 178.128.236.45.22 > 99.228.153.224.50332: Flags [P.], seq 17576:17844, ack 1, win 501, length 268
20:19:18.349464 IP 178.128.236.45.22 > 99.228.153.224.50332: Flags [P.], seq 17844:18112, ack 1, win 501, length 268
20:19:18.349515 IP 178.128.236.45.22 > 99.228.153.224.50332: Flags [P.], seq 18112:18380, ack 1, win 501, length 268
20:19:18.349574 IP 178.128.236.45.22 > 99.228.153.224.50332: Flags [P.], seq 18380:18760, ack 1, win 501, length 380
20:19:18.349635 IP 178.128.236.45.22 > 99.228.153.224.50332: Flags [P.], seq 18760:19140, ack 1, win 501, length 380
20:19:18.349686 IP 178.128.236.45.22 > 99.228.153.224.50332: Flags [P.], seq 19140:19408, ack 1, win 501, length 268
20:19:18.349743 IP 178.128.236.45.22 > 99.228.153.224.50332: Flags [P.], seq 19408:19788, ack 1, win 501, length 380
20:19:18.349792 IP 178.128.236.45.22 > 99.228.153.224.50332: Flags [P.], seq 19788:20056, ack 1, win 501, length 268
20:19:18.349852 IP 178.128.236.45.22 > 99.228.153.224.50332: Flags [P.], seq 20056:20444, ack 1, win 501, length 388
20:19:18.349902 IP 178.128.236.45.22 > 99.228.153.224.50332: Flags [P.], seq 20444:20720, ack 1, win 501, length 276
20:19:18.349961 IP 178.128.236.45.22 > 99.228.153.224.50332: Flags [P.], seq 20720:21108, ack 1, win 501, length 388
20:19:18.350026 IP 178.128.236.45.22 > 99.228.153.224.50332: Flags [P.], seq 21108:21496, ack 1, win 501, length 388
20:19:18.350099 IP 178.128.236.45.22 > 99.228.153.224.50332: Flags [P.], seq 21496:21772, ack 1, win 501, length 276
20:19:18.350169 IP 178.128.236.45.22 > 99.228.153.224.50332: Flags [P.], seq 21772:22016, ack 1, win 501, length 244
20:19:18.350230 IP 178.128.236.45.22 > 99.228.153.224.50332: Flags [P.], seq 22016:22276, ack 1, win 501, length 260
20:19:18.360850 IP 99.228.153.224.50332 > 178.128.236.45.22: Flags [.], ack 14612, win 4105, length 0
20:19:18.367302 IP 99.228.153.224.50332 > 178.128.236.45.22: Flags [.], ack 22276, win 4106, length 0
20:19:18.382797 IP 99.228.153.224.50332 > 178.128.236.45.22: Flags [P.], seq 1:37, ack 22276, win 4106, length 36
20:19:18.426708 IP 178.128.236.45.22 > 99.228.153.224.50332: Flags [.], ack 37, win 501, length 0
20:19:18.451036 IP 178.128.236.45.22 > 99.228.153.224.50332: Flags [P.], seq 22276:23248, ack 37, win 501, length 972
20:19:18.451344 IP 178.128.236.45.22 > 99.228.153.224.50332: Flags [P.], seq 23248:25756, ack 37, win 501, length 2508
20:19:18.451458 IP 178.128.236.45.22 > 99.228.153.224.50332: Flags [P.], seq 25756:26496, ack 37, win 501, length 740
20:19:18.451538 IP 178.128.236.45.22 > 99.228.153.224.50332: Flags [P.], seq 26496:27004, ack 37, win 501, length 508
20:19:18.451605 IP 178.128.236.45.22 > 99.228.153.224.50332: Flags [P.], seq 27004:27392, ack 37, win 501, length 388
20:19:18.451658 IP 178.128.236.45.22 > 99.228.153.224.50332: Flags [P.], seq 27392:27668, ack 37, win 501, length 276
20:19:18.451721 IP 178.128.236.45.22 > 99.228.153.224.50332: Flags [P.], seq 27668:27936, ack 37, win 501, length 268
20:19:18.451772 IP 178.128.236.45.22 > 99.228.153.224.50332: Flags [P.], seq 27936:28212, ack 37, win 501, length 276
20:19:18.451837 IP 178.128.236.45.22 > 99.228.153.224.50332: Flags [P.], seq 28212:28600, ack 37, win 501, length 388
20:19:18.451889 IP 178.128.236.45.22 > 99.228.153.224.50332: Flags [P.], seq 28600:28876, ack 37, win 501, length 276
20:19:18.451942 IP 178.128.236.45.22 > 99.228.153.224.50332: Flags [P.], seq 28876:29152, ack 37, win 501, length 276
20:19:18.452002 IP 178.128.236.45.22 > 99.228.153.224.50332: Flags [P.], seq 29152:29540, ack 37, win 501, length 388
20:19:18.452053 IP 178.128.236.45.22 > 99.228.153.224.50332: Flags [P.], seq 29540:29816, ack 37, win 501, length 276
20:19:18.452115 IP 178.128.236.45.22 > 99.228.153.224.50332: Flags [P.], seq 29816:30204, ack 37, win 501, length 388
20:19:18.452176 IP 178.128.236.45.22 > 99.228.153.224.50332: Flags [P.], seq 30204:30592, ack 37, win 501, length 388
20:19:18.452245 IP 178.128.236.45.22 > 99.228.153.224.50332: Flags [P.], seq 30592:30868, ack 37, win 501, length 276
20:19:18.452349 IP 178.128.236.45.22 > 99.228.153.224.50332: Flags [P.], seq 30868:31376, ack 37, win 501, length 508
20:19:18.452403 IP 178.128.236.45.22 > 99.228.153.224.50332: Flags [P.], seq 31376:31652, ack 37, win 501, length 276
20:19:18.452468 IP 178.128.236.45.22 > 99.228.153.224.50332: Flags [P.], seq 31652:32040, ack 37, win 501, length 388
20:19:18.452520 IP 178.128.236.45.22 > 99.228.153.224.50332: Flags [P.], seq 32040:32300, ack 37, win 501, length 260
20:19:18.452582 IP 178.128.236.45.22 > 99.228.153.224.50332: Flags [P.], seq 32300:32656, ack 37, win 501, length 356
20:19:18.452628 IP 178.128.236.45.22 > 99.228.153.224.50332: Flags [P.], seq 32656:32692, ack 37, win 501, length 36
20:19:18.466581 IP 99.228.153.224.50332 > 178.128.236.45.22: Flags [.], ack 32692, win 4106, length 0
20:19:18.554833 IP 178.128.236.45.22 > 99.228.153.224.50332: Flags [P.], seq 32692:32848, ack 37, win 501, length 156
20:19:18.555043 IP 178.128.236.45.22 > 99.228.153.224.50332: Flags [P.], seq 32848:33604, ack 37, win 501, length 756
20:19:18.555132 IP 178.128.236.45.22 > 99.228.153.224.50332: Flags [P.], seq 33604:34240, ack 37, win 501, length 636
20:19:18.555195 IP 178.128.236.45.22 > 99.228.153.224.50332: Flags [P.], seq 34240:34636, ack 37, win 501, length 396
20:19:18.555250 IP 178.128.236.45.22 > 99.228.153.224.50332: Flags [P.], seq 34636:34912, ack 37, win 501, length 276
20:19:18.555315 IP 178.128.236.45.22 > 99.228.153.224.50332: Flags [P.], seq 34912:35308, ack 37, win 501, length 396
20:19:18.555374 IP 178.128.236.45.22 > 99.228.153.224.50332: Flags [P.], seq 35308:35464, ack 37, win 501, length 156
20:19:18.555427 IP 178.128.236.45.22 > 99.228.153.224.50332: Flags [P.], seq 35464:35724, ack 37, win 501, length 260
20:19:18.555474 IP 178.128.236.45.22 > 99.228.153.224.50332: Flags [P.], seq 35724:35760, ack 37, win 501, length 36
20:19:18.568523 IP 99.228.153.224.50332 > 178.128.236.45.22: Flags [.], ack 35760, win 4106, length 0
20:19:18.658876 IP 178.128.236.45.22 > 99.228.153.224.50332: Flags [P.], seq 35760:35916, ack 37, win 501, length 156
20:19:18.659058 IP 178.128.236.45.22 > 99.228.153.224.50332: Flags [P.], seq 35916:36192, ack 37, win 501, length 276
20:19:18.659170 IP 178.128.236.45.22 > 99.228.153.224.50332: Flags [P.], seq 36192:36828, ack 37, win 501, length 636
20:19:18.659234 IP 178.128.236.45.22 > 99.228.153.224.50332: Flags [P.], seq 36828:37088, ack 37, win 501, length 260
20:19:18.671834 IP 99.228.153.224.50332 > 178.128.236.45.22: Flags [.], ack 37088, win 4101, length 0
20:19:18.762882 IP 178.128.236.45.22 > 99.228.153.224.50332: Flags [P.], seq 37088:37244, ack 37, win 501, length 156
20:19:18.763035 IP 178.128.236.45.22 > 99.228.153.224.50332: Flags [P.], seq 37244:37400, ack 37, win 501, length 156
20:19:18.763105 IP 178.128.236.45.22 > 99.228.153.224.50332: Flags [P.], seq 37400:37556, ack 37, win 501, length 156
20:19:18.763189 IP 178.128.236.45.22 > 99.228.153.224.50332: Flags [P.], seq 37556:37816, ack 37, win 501, length 260
20:19:18.777748 IP 99.228.153.224.50332 > 178.128.236.45.22: Flags [.], ack 37556, win 4106, length 0
20:19:18.784570 IP 99.228.153.224.50332 > 178.128.236.45.22: Flags [.], ack 37816, win 4105, length 0
20:19:18.866901 IP 178.128.236.45.22 > 99.228.153.224.50332: Flags [P.], seq 37816:37972, ack 37, win 501, length 156
20:19:18.867090 IP 178.128.236.45.22 > 99.228.153.224.50332: Flags [P.], seq 37972:38576, ack 37, win 501, length 604
20:19:18.881486 IP 99.228.153.224.50332 > 178.128.236.45.22: Flags [.], ack 38576, win 4102, length 0
20:19:18.970863 IP 178.128.236.45.22 > 99.228.153.224.50332: Flags [P.], seq 38576:38732, ack 37, win 501, length 156
20:19:18.971042 IP 178.128.236.45.22 > 99.228.153.224.50332: Flags [P.], seq 38732:38992, ack 37, win 501, length 260
20:19:18.971086 IP 178.128.236.45.22 > 99.228.153.224.50332: Flags [P.], seq 38992:39028, ack 37, win 501, length 36
20:19:18.985095 IP 99.228.153.224.50332 > 178.128.236.45.22: Flags [.], ack 39028, win 4106, length 0
20:19:19.074862 IP 178.128.236.45.22 > 99.228.153.224.50332: Flags [P.], seq 39028:39184, ack 37, win 501, length 156
20:19:19.075011 IP 178.128.236.45.22 > 99.228.153.224.50332: Flags [P.], seq 39184:39564, ack 37, win 501, length 380
20:19:19.075051 IP 178.128.236.45.22 > 99.228.153.224.50332: Flags [P.], seq 39564:39600, ack 37, win 501, length 36
20:19:19.091287 IP 99.228.153.224.50332 > 178.128.236.45.22: Flags [.], ack 39600, win 4104, length 0
20:19:19.178896 IP 178.128.236.45.22 > 99.228.153.224.50332: Flags [P.], seq 39600:39756, ack 37, win 501, length 156
20:19:19.179046 IP 178.128.236.45.22 > 99.228.153.224.50332: Flags [P.], seq 39756:40136, ack 37, win 501, length 380
20:19:19.192446 IP 99.228.153.224.50332 > 178.128.236.45.22: Flags [.], ack 40136, win 4101, length 0
20:19:19.282897 IP 178.128.236.45.22 > 99.228.153.224.50332: Flags [P.], seq 40136:40412, ack 37, win 501, length 276
20:19:19.283036 IP 178.128.236.45.22 > 99.228.153.224.50332: Flags [P.], seq 40412:40552, ack 37, win 501, length 140
20:19:19.299049 IP 99.228.153.224.50332 > 178.128.236.45.22: Flags [.], ack 40552, win 4106, length 0
20:19:19.386870 IP 178.128.236.45.22 > 99.228.153.224.50332: Flags [P.], seq 40552:40932, ack 37, win 501, length 380
20:19:19.458008 IP 99.228.153.224.50332 > 178.128.236.45.22: Flags [.], ack 40932, win 4104, length 0
20:19:19.490906 IP 178.128.236.45.22 > 99.228.153.224.50332: Flags [P.], seq 40932:41192, ack 37, win 501, length 260
20:19:19.548744 IP 99.228.153.224.50332 > 178.128.236.45.22: Flags [.], ack 41192, win 4103, length 0
20:19:19.594904 IP 178.128.236.45.22 > 99.228.153.224.50332: Flags [P.], seq 41192:41452, ack 37, win 501, length 260
20:19:19.659022 IP 99.228.153.224.50332 > 178.128.236.45.22: Flags [.], ack 41452, win 4102, length 0
20:19:19.698897 IP 178.128.236.45.22 > 99.228.153.224.50332: Flags [P.], seq 41452:41712, ack 37, win 501, length 260
20:19:19.760578 IP 99.228.153.224.50332 > 178.128.236.45.22: Flags [.], ack 41712, win 4101, length 0
20:19:19.802860 IP 178.128.236.45.22 > 99.228.153.224.50332: Flags [P.], seq 41712:41972, ack 37, win 501, length 260
20:19:19.807843 IP 66.175.215.158.61000 > 178.128.236.45.110: Flags [S], seq 1444546390, win 1024, length 0
20:19:19.855900 IP 99.228.153.224.50332 > 178.128.236.45.22: Flags [.], ack 41972, win 4100, length 0
20:19:19.906961 IP 178.128.236.45.22 > 99.228.153.224.50332: Flags [P.], seq 41972:42344, ack 37, win 501, length 372
20:19:19.974362 IP 99.228.153.224.50332 > 178.128.236.45.22: Flags [.], ack 42344, win 4106, length 0
20:19:20.010909 IP 178.128.236.45.22 > 99.228.153.224.50332: Flags [P.], seq 42344:42604, ack 37, win 501, length 260
20:19:20.071460 IP 99.228.153.224.50332 > 178.128.236.45.22: Flags [.], ack 42604, win 4105, length 0
20:19:20.114900 IP 178.128.236.45.22 > 99.228.153.224.50332: Flags [P.], seq 42604:42864, ack 37, win 501, length 260
20:19:20.171018 IP 99.228.153.224.50332 > 178.128.236.45.22: Flags [.], ack 42864, win 4104, length 0
20:19:20.175852 IP 15.152.212.181 > 178.128.236.45: ICMP echo request, id 26, seq 14213, length 48
20:19:20.175904 IP 178.128.236.45 > 15.152.212.181: ICMP echo reply, id 26, seq 14213, length 48
^C
292 packets captured
296 packets received by filter
0 packets dropped by kernel
root@lamp-ubuntu-s-1vcpu-1gb-tor1-01:~#