root@lamp-ubuntu-s-1vcpu-1gb-tor1-01:~# tcpdump -A -i eth0
tcpdump: verbose output suppressed, use -v[v]... for full protocol decode
listening on eth0, link-type EN10MB (Ethernet), snapshot length 262144 bytes
20:10:37.053047 IP lamp-ubuntu-s-1vcpu-1gb-tor1-01.ssh > pool-99-228-153-224.cpe.net.cable.rogers.com.50332: Flags [P.], seq 3646983367:3646983475, ack 704795569, win 501, length 108
E.....@.@......-c........`..*.S.P........[s......`...>R.......{..&,.....zq.9..r.....J....lV..J.v.y.......i..0DDt.K....A..BL..:..$......@).!...w...4.
20:10:37.053123 IP lamp-ubuntu-s-1vcpu-1gb-tor1-01.ssh > pool-99-228-153-224.cpe.net.cable.rogers.com.50332: Flags [P.], seq 108:144, ack 1, win 501, length 36
E..L..@.@......-c........`.3*.S.P........Q.U...t...+.?.K...e......~...F..|..
20:10:37.053167 IP lamp-ubuntu-s-1vcpu-1gb-tor1-01.ssh > pool-99-228-153-224.cpe.net.cable.rogers.com.50332: Flags [P.], seq 144:196, ack 1, win 501, length 52
E..\..@.@......-c........`.W*.S.P.......        Q%.........}"EQ..IV...........e...........I...9l.L.
20:10:37.053208 IP lamp-ubuntu-s-1vcpu-1gb-tor1-01.ssh > pool-99-228-153-224.cpe.net.cable.rogers.com.50332: Flags [P.], seq 196:264, ack 1, win 501, length 68
E..l..@.@......-c........`..*.S.P...........5I.....*m...ht.q.....V._.a...qJ..ov/L..s.%&.......%F.f.LA..Y....
20:10:37.053248 IP lamp-ubuntu-s-1vcpu-1gb-tor1-01.ssh > pool-99-228-153-224.cpe.net.cable.rogers.com.50332: Flags [P.], seq 264:332, ack 1, win 501, length 68
E..l..@.@......-c........`..*.S.P.......S.r9....v.. .B......WDL^H.x..ZI..;.i.E]...
....G.....0Y..f..(T...u..
20:10:37.053275 IP lamp-ubuntu-s-1vcpu-1gb-tor1-01.ssh > pool-99-228-153-224.cpe.net.cable.rogers.com.50332: Flags [P.], seq 332:368, ack 1, win 501, length 36
E..L..@.@......-c........`..*.S.P..............M..hU X%.\d.<
@4.8t\..H... .3
20:10:37.070030 IP pool-99-228-153-224.cpe.net.cable.rogers.com.50332 > lamp-ubuntu-s-1vcpu-1gb-tor1-01.ssh: Flags [.], ack 368, win 4100, length 0
E..(TA@.w...c......-....*.S..`.7P...Y_........
20:10:37.103322 IP 2.57.122.189.58966 > lamp-ubuntu-s-1vcpu-1gb-tor1-01.ssh: Flags [P.], seq 1873148425:1873148441, ack 2751817206, win 263, options [nop,nop,TS val 2275859425 ecr 2366369462], length 16
E..D..@.7.R1.9z....-.V..o..     ..e............
............
.....].::..
20:10:37.103322 IP 2.57.122.189.58966 > lamp-ubuntu-s-1vcpu-1gb-tor1-01.ssh: Flags [P.], seq 16:68, ack 1, win 263, options [nop,nop,TS val 2275859425 ecr 2366369462], length 52
E..h..@.7.R..9z....-.V..o.....e............
........... .l;..S)..E.,.ja.5..{..@~...
....(\..
..\.o.E.r@.
20:10:37.103425 IP lamp-ubuntu-s-1vcpu-1gb-tor1-01.ssh > 2.57.122.189.58966: Flags [.], ack 68, win 502, options [nop,nop,TS val 2366369589 ecr 2275859425], length 0
E..4    .@.@......-.9z....V..e.o..M...........
...5....
20:10:37.103532 IP lamp-ubuntu-s-1vcpu-1gb-tor1-01.ssh > 2.57.122.189.58966: Flags [P.], seq 1:53, ack 68, win 502, options [nop,nop,TS val 2366369589 ecr 2275859425], length 52
E..h    .@.@......-.9z....V..e.o..M...........
...5....... ....ICS&z...*...Nv..............P.~HO........?R+
20:10:37.151555 IP lamp-ubuntu-s-1vcpu-1gb-tor1-01.36397 > 67.207.67.3.domain: 177+ [1au] PTR? 224.153.228.99.in-addr.arpa. (56)
E..T....@.J....-C.C..-.5.@%..............224.153.228.99.in-addr.arpa.......)........
20:10:37.151734 IP lamp-ubuntu-s-1vcpu-1gb-tor1-01.47168 > 67.207.67.3.domain: Flags [S], seq 2316276488, win 64240, options [mss 1460,sackOK,TS val 2269412437 ecr 0,nop,wscale 7,tfo  cookiereq,nop,nop], length 0
E..@..@.@.f....-C.C..@.5............%..........
.D|U........"...
20:10:37.151967 IP 67.207.67.3.domain > lamp-ubuntu-s-1vcpu-1gb-tor1-01.36397: 177 1/0/1 PTR pool-99-228-153-224.cpe.net.cable.rogers.com. (114)
E.......<.Z.C.C....-.5.-.zj..............224.153.228.99.in-addr.arpa.............P....pool-99-228-153-224.cpe.net.cable.rogers.com...)........
20:10:37.152020 IP 67.207.67.3.domain > lamp-ubuntu-s-1vcpu-1gb-tor1-01.47168: Flags [S.], seq 921455673, ack 2316276489, win 65160, options [mss 1460,sackOK,TS val 1553160440 ecr 2269412437,nop,wscale 9], length 0
E..<..@.<..<C.C....-.5.@6.L9... ...............
\.X..D|U...
20:10:37.152044 IP lamp-ubuntu-s-1vcpu-1gb-tor1-01.47168 > 67.207.67.3.domain: Flags [.], ack 1, win 502, options [nop,nop,TS val 2269412437 ecr 1553160440], length 0
E..4..@.@.f....-C.C..@.5...     6.L:....%......
.D|U\.X.
20:10:37.152074 IP lamp-ubuntu-s-1vcpu-1gb-tor1-01.47168 > 67.207.67.3.domain: Flags [P.], seq 1:48, ack 1, win 502, options [nop,nop,TS val 2269412437 ecr 1553160440], length 47 65261+ PTR? 224.153.228.99.in-addr.arpa. (45)
E..c..@.@.fx...-C.C..@.5...     6.L:....%......
.D|U\.X..-.............224.153.228.99.in-addr.arpa.....
20:10:37.152218 IP lamp-ubuntu-s-1vcpu-1gb-tor1-01.49651 > 67.207.67.3.domain: 51879+ [1au] PTR? 45.236.128.178.in-addr.arpa. (56)
E..T....@......-C.C....5.@%..............45.236.128.178.in-addr.arpa.......)........
20:10:37.152314 IP 67.207.67.3.domain > lamp-ubuntu-s-1vcpu-1gb-tor1-01.47168: Flags [.], ack 48, win 128, options [nop,nop,TS val 1553160441 ecr 2269412437], length 0
E..4e.@.<..sC.C....-.5.@6.L:...8....>......
\.X..D|U
20:10:37.152618 IP 67.207.67.3.domain > lamp-ubuntu-s-1vcpu-1gb-tor1-01.49651: 51879 NXDomain 0/1/1 (123)
E.......<.Z.C.C....-.5....0..............45.236.128.178.in-addr.arpa..............a.7.ns1.digitalocean.com.
hostmaster..g..`..*0.....       :.......)........
20:10:37.152668 IP lamp-ubuntu-s-1vcpu-1gb-tor1-01.49651 > 67.207.67.3.domain: 51879+ PTR? 45.236.128.178.in-addr.arpa. (45)
E..I....@..!...-C.C....5.5%..............45.236.128.178.in-addr.arpa.....
20:10:37.152902 IP 67.207.67.3.domain > lamp-ubuntu-s-1vcpu-1gb-tor1-01.49651: 51879 NXDomain 0/1/0 (112)
E.......<.Z.C.C....-.5...xY..............45.236.128.178.in-addr.arpa..............a.7.ns1.digitalocean.com.
hostmaster..g..`..*0.....       :.....
20:10:37.153088 IP 67.207.67.3.domain > lamp-ubuntu-s-1vcpu-1gb-tor1-01.47168: Flags [P.], seq 1:106, ack 48, win 128, options [nop,nop,TS val 1553160441 ecr 2269412437], length 105 65261 1/0/0 PTR pool-99-228-153-224.cpe.net.cable.rogers.com. (103)
E...e.@.<..     C.C....-.5.@6.L:...8....`......
\.X..D|U.g.............224.153.228.99.in-addr.arpa.............P....pool-99-228-153-224.cpe.net.cable.rogers.com.
20:10:37.153097 IP lamp-ubuntu-s-1vcpu-1gb-tor1-01.47168 > 67.207.67.3.domain: Flags [.], ack 106, win 502, options [nop,nop,TS val 2269412438 ecr 1553160441], length 0
E..4..@.@.f....-C.C..@.5...86.L.....%......
.D|V\.X.
20:10:37.153270 IP lamp-ubuntu-s-1vcpu-1gb-tor1-01.ssh > pool-99-228-153-224.cpe.net.cable.rogers.com.50332: Flags [P.], seq 368:588, ack 1, win 501, length 220
E.....@.@..R...-c........`.7*.S.P....i...5..].x........./z......P.O..9.d.       .`...S..}...Y.....T....T.P#A0.!21.{........)K.ml....*.......
.J....v_jpXs+.......
d..zV.G.5..w.eS....Bx...^.0.....zl..P...GU.....<..p..j.C.v....U.....]~.....kfI.."et..r.+;..."..V2.......
20:10:37.153306 IP lamp-ubuntu-s-1vcpu-1gb-tor1-01.ssh > pool-99-228-153-224.cpe.net.cable.rogers.com.50332: Flags [P.], seq 588:624, ack 1, win 501, length 36
E..L..@.@..     ...-c........`..*.S.P.............u.....%.Q...f'@.A.zOS./.......
20:10:37.153345 IP lamp-ubuntu-s-1vcpu-1gb-tor1-01.ssh > pool-99-228-153-224.cpe.net.cable.rogers.com.50332: Flags [P.], seq 624:812, ack 1, win 501, length 188
E.... @.@..p...-c........`.7*.S.P....I..].z.n.t....W....>>...f.t>6.(.....B....x.X..Y./[d@....O..K.,.M...V..D.#_.(..wZ%p..+P....},........UB..BS`/....
]=Q....*..`
+]X.:.8..-.9..(....\,{..        .ct..+........q..A...9.2i.D3.;9.{.0.SV.1H
20:10:37.153371 IP lamp-ubuntu-s-1vcpu-1gb-tor1-01.ssh > pool-99-228-153-224.cpe.net.cable.rogers.com.50332: Flags [P.], seq 812:848, ack 1, win 501, length 36
E..L.!@.@......-c........`..*.S.P........b...^...!......
C.t?..rV7........-.
20:10:37.153432 IP lamp-ubuntu-s-1vcpu-1gb-tor1-01.ssh > pool-99-228-153-224.cpe.net.cable.rogers.com.50332: Flags [P.], seq 848:1044, ack 1, win 501, length 196
E...."@.@..f...-c........`..*.S.P....Q.....b.d..m6......m}......V.^..G..NpZ?.........~.Z2..po<.....hk.."=..5N.^.......s|..
i_..!.....2..&..F?..............M.N...a.=...;u.....E.q..,..z......m."|.....sV.V!u&...,.[..3S9\0-K...8Q .a....y.?.
20:10:37.153457 IP lamp-ubuntu-s-1vcpu-1gb-tor1-01.ssh > pool-99-228-153-224.cpe.net.cable.rogers.com.50332: Flags [P.], seq 1044:1080, ack 1, win 501, length 36
E..L.#@.@......-c........`..*.S.P.......4........P......nI...vN.....ZhvO....
20:10:37.153489 IP lamp-ubuntu-s-1vcpu-1gb-tor1-01.ssh > pool-99-228-153-224.cpe.net.cable.rogers.com.50332: Flags [P.], seq 1080:1196, ack 1, win 501, length 116
E....$@.@......-c........`..*.S.P........1*.../<u^.[.pY....:Uo...N*AHxR*.d8Py...b1o..(8y.5b.(\....'..6|o...mC.L.A.....!.K..VK.z
..a<..\......$.k..tTF...&}..
20:10:37.153515 IP lamp-ubuntu-s-1vcpu-1gb-tor1-01.ssh > pool-99-228-153-224.cpe.net.cable.rogers.com.50332: Flags [P.], seq 1196:1232, ack 1, win 501, length 36
E..L.%@.@......-c........`.s*.S.P........x.t.......?.[....X./......{D.......
20:10:37.153551 IP lamp-ubuntu-s-1vcpu-1gb-tor1-01.ssh > pool-99-228-153-224.cpe.net.cable.rogers.com.50332: Flags [P.], seq 1232:1428, ack 1, win 501, length 196
E....&@.@..b...-c........`..*.S.P....Q...m.p.....-. ...
..J8.....B....t}(...9.U.~.?.r..5?..%.t..9.."..l...D~H.
.......W.....   ......g.4.H.m.l..#...i..EwX...bYh........9Z.W.,Q.s#.K..b.(..c.VA-EiVt..h..........o.5.....o...........D..}....$
20:10:37.153576 IP lamp-ubuntu-s-1vcpu-1gb-tor1-01.ssh > pool-99-228-153-224.cpe.net.cable.rogers.com.50332: Flags [P.], seq 1428:1464, ack 1, win 501, length 36
E..L.'@.@......-c........`.[*.S.P.......K].n'X..;N+v.....UM..@.=W......l4.].
20:10:37.153608 IP lamp-ubuntu-s-1vcpu-1gb-tor1-01.ssh > pool-99-228-153-224.cpe.net.cable.rogers.com.50332: Flags [P.], seq 1464:1540, ack 1, win 501, length 76
E..t.(@.@......-c........`..*.S.P.......J. .NM.x
8.d....<.%.s....O..G.G:..<..$....},...B.w...<L....%.v=.....ffV....~
20:10:37.153633 IP lamp-ubuntu-s-1vcpu-1gb-tor1-01.ssh > pool-99-228-153-224.cpe.net.cable.rogers.com.50332: Flags [P.], seq 1540:1576, ack 1, win 501, length 36
E..L.)@.@......-c........`..*.S.P.......k.Y...p[...?...1.+k.S..*.^w...h"YQ.f
20:10:37.153658 IP lamp-ubuntu-s-1vcpu-1gb-tor1-01.ssh > pool-99-228-153-224.cpe.net.cable.rogers.com.50332: Flags [P.], seq 1576:1668, ack 1, win 501, length 92
E....*@.@......-c........`..*.S.P.......+.....n..We...1..X\..~.....g...tE.gK....K..E........Hn...+.....z..)#....d.xG.,ix\%.ra......j
20:10:37.153681 IP lamp-ubuntu-s-1vcpu-1gb-tor1-01.ssh > pool-99-228-153-224.cpe.net.cable.rogers.com.50332: Flags [P.], seq 1668:1704, ack 1, win 501, length 36
E..L.+@.@......-c........`.K*.S.P.......C[O..g.}.J.9fw....Z...dB..A.    .H@/...
20:10:37.153716 IP lamp-ubuntu-s-1vcpu-1gb-tor1-01.ssh > pool-99-228-153-224.cpe.net.cable.rogers.com.50332: Flags [P.], seq 1704:1900, ack 1, win 501, length 196
E....,@.@..\...-c........`.o*.S.P....Q..%9..@W....&..Y.l..5......].4.x3..V....-.x.[....h..o.......>..88.........b..-........L<...../..(....H)...2b..x.g...G9.....K..... ......#.6.].:...~.8.~......e.....)........FG.Emh=.H.q6...:..^. 6.<..
20:10:37.153743 IP lamp-ubuntu-s-1vcpu-1gb-tor1-01.ssh > pool-99-228-153-224.cpe.net.cable.rogers.com.50332: Flags [P.], seq 1900:1936, ack 1, win 501, length 36
E..L.-@.@......-c........`.3*.S.P.......:.M7...*#..1.`.I..      4....1..jjAX6u.x.
20:10:37.153776 IP lamp-ubuntu-s-1vcpu-1gb-tor1-01.ssh > pool-99-228-153-224.cpe.net.cable.rogers.com.50332: Flags [P.], seq 1936:2084, ack 1, win 501, length 148
E.....@.@......-c........`.W*.S.P....!..Z;0.%4.\...Ff..:.$...).......K  ..?.........J.B.!...........+P"Y.........d.3.....*|..^......B@R.......W...d.fwb.pv..^..KC...o.!:`.........H....=.....
20:10:37.154515 IP lamp-ubuntu-s-1vcpu-1gb-tor1-01.35465 > 67.207.67.3.domain: 4726+ [1au] PTR? 189.122.57.2.in-addr.arpa. (54)
E..RK...@.
....-C.C....5.>%..v...........189.122.57.2.in-addr.arpa.......)........
20:10:37.154574 IP lamp-ubuntu-s-1vcpu-1gb-tor1-01.38515 > 67.207.67.3.domain: 59808+ [1au] PTR? 189.122.57.2.in-addr.arpa. (54)
E..R....@.CZ...-C.C..s.5.>%..............189.122.57.2.in-addr.arpa.......)........
20:10:37.154599 IP lamp-ubuntu-s-1vcpu-1gb-tor1-01.47168 > 67.207.67.3.domain: Flags [P.], seq 48:93, ack 106, win 502, options [nop,nop,TS val 2269412439 ecr 1553160441], length 45 40576+ PTR? 189.122.57.2.in-addr.arpa. (43)
E..a..@.@.fx...-C.C..@.5...86.L.....%......
.D|W\.X..+.............189.122.57.2.in-addr.arpa.....
20:10:37.154860 IP 67.207.67.3.domain > lamp-ubuntu-s-1vcpu-1gb-tor1-01.47168: Flags [P.], seq 106:216, ack 93, win 128, options [nop,nop,TS val 1553160443 ecr 2269412439], length 110 40576 NXDomain 0/1/0 (108)
E...e.@.<...C.C....-.5.@6.L....e...........
\.X..D|W.l.............189.122.57.2.in-addr.arpa................5.ns5.pptechnology.cc.
2023121863...p.... .    :...Q.....
20:10:37.155134 IP 67.207.67.3.domain > lamp-ubuntu-s-1vcpu-1gb-tor1-01.35465: 4726 NXDomain 0/1/1 (119)
E.......<.Z.C.C....-.5....u..v...........189.122.57.2.in-addr.arpa................5.ns5.pptechnology.cc.
2023121863...p.... .    :...Q.......)........
20:10:37.155134 IP 67.207.67.3.domain > lamp-ubuntu-s-1vcpu-1gb-tor1-01.38515: 59808 NXDomain 0/1/1 (119)
E.......<.Z.C.C....-.5.s.................189.122.57.2.in-addr.arpa................5.ns5.pptechnology.cc.
2023121863...p.... .    :...Q.......)........
20:10:37.155298 IP lamp-ubuntu-s-1vcpu-1gb-tor1-01.35465 > 67.207.67.3.domain: 4726+ PTR? 189.122.57.2.in-addr.arpa. (43)
E..GK...@.
....-C.C....5.3%..v...........189.122.57.2.in-addr.arpa.....
20:10:37.155340 IP lamp-ubuntu-s-1vcpu-1gb-tor1-01.38515 > 67.207.67.3.domain: 59808+ PTR? 189.122.57.2.in-addr.arpa. (43)
E..G....@.Cd...-C.C..s.5.3%..............189.122.57.2.in-addr.arpa.....
20:10:37.155716 IP 67.207.67.3.domain > lamp-ubuntu-s-1vcpu-1gb-tor1-01.38515: 59808 NXDomain 0/1/0 (108)
E.......<.Z.C.C....-.5.s.t...............189.122.57.2.in-addr.arpa................5.ns5.pptechnology.cc.
2023121863...p.... .    :...Q.....
20:10:37.155716 IP 67.207.67.3.domain > lamp-ubuntu-s-1vcpu-1gb-tor1-01.35465: 4726 NXDomain 0/1/0 (108)
E.......<.Z.C.C....-.5...t...v...........189.122.57.2.in-addr.arpa................5.ns5.pptechnology.cc.
2023121863...p.... .    :...Q.....
20:10:37.161036 IP pool-99-228-153-224.cpe.net.cable.rogers.com.50332 > lamp-ubuntu-s-1vcpu-1gb-tor1-01.ssh: Flags [.], ack 2084, win 4106, length 0
E..(TB@.w...c......-....*.S..`..P..
R.........
20:10:37.161101 IP lamp-ubuntu-s-1vcpu-1gb-tor1-01.ssh > pool-99-228-153-224.cpe.net.cable.rogers.com.50332: Flags [P.], seq 2084:5004, ack 1, win 501, length 2920
E..../@.@......-c........`..*.S.P........7
':X".M...Z.T.T....?@...i.M..G.E.U.".....y.....C.M..EkC...i..bK...SpD...Q.F.......JS....&......Xnm/3...  ..../~.-0......xQ......A._}.....aP...T.x..r...gB..h..................>8.D..].O.>F.L).L..3.W(t,..IC..K.'.....[.t]        Z..q.l..E.5.03zA....(..u.dk.8.. ....*.c...A.f.t..dm9)y.J.Yn.@.....r....;.Ka..
3#MX...U/...b.D|......h.K.WU...,.:k&..B......N...W..!c.O..`.6S....U..y...........,.d2......)n..>.(.C.........o...(....l.../...KbsP...*/d.(;.&....`.S.....Y.k@;Fk..e...0PY..H....tB.9..V?....-.`.....<....b.rJ;`}....A..0..I....a5...k..Itj.6...`...ic.(.;+.0O_i4..?UB.f..~O.>hD....0+.2...#N.....P.Oe....:..}*...t.`..C..........z..u2....T?.9&........($........o..4@/..c....K.=6......;.YcU.>..8.......L..U...        ..=R..._.].S....1..c.....m.[ze..w...{.g..~.Pn{.tN..4.......L...a.(.7D.!.-.+.l/.......[
+x...........d..v.....-.2a.k(......
4#ULz..zP...$}.+....c....Lc..6K .....   !*.~|...>....Z..g..r....Z..;.n....E.(...t.A...b.[..}..:yz."?F
E.O1....S......*..
to..&6...B....;.K...],-.|B.....Lk.c..F8...w.....+.
w;..."..n.....n.3C....
W...F.g......'o..?.9.<.%..0.|.{..3
C{..d.y~..h....L.R~.\b.....m,V...)...C~......_'M.8T.hR0.bKf
1s.kG..'..0I.^....3..P.&x....?....kL...W..\......{.../......Q....$..[.>.8.....O..X.../8......x.l#...s..{.K..&i..$..%%.g.%m......J-S..o..R.....m..ZiX..D...`...............#Je..7.z.....j......:d7............f. `@..........H....R....FwxU..M.9...$.....j...EV7~X*........Ys........YkD....O..g..`$..[.W0.P.w.j8|....(."<...Jx.Z...Z.g.H......`.nT......2D..zC.<.lI.\~......./.. %O..*.r*..1#!...,9th<^.".QO4.~'wB...w.o.q..3...w...l3<.                ..I.L.'.;..E.!.$ZB.,..?&.....D.GF..6o..(..Q(....!..3.P...H.B.y...4Hc...S...LJ..u.@.~..?)t9^(.....`7...~.....3...&;^.w...LL...=  .L...Y.../.Z.f...=.].-..]..C.T."...M$....H..d...        ..}_......U....U.9 h..2.~....`.........C.Z.B.+.._n....I..._).).W.}.[.......R...j.m&.. *...|#.^../..XU..$...M5.dj.....q}.F..|......r..h..,.Q4....        .....m.^'Gm..8...w.]s.G.3.k0...y..e.U.  e .B...].F..O4.q'.d...../.J.o.......R...'q.?...<C.r..{AA.c.2......\....$].5M...f.9.Vc.....h..C..8.w+wU..yv_.\he.M6..~.t.J.M..{...a..*Ne.I.....dX..M=.P .......
r...3..G-.....b'SC ..oSk.9...
....P."......2....^V...;.c~...fmU'b..X....OY_9Cz..B....k..........!
.....R....}..Fm.L.K.TZ..............7.Sg`.W..P9..=^......)N..N #..!'.5..^
.hj....p..9..w.._.'7..A...n....@D.C...LR..Y.
^...h....EyZ&.%..O...xdOOa.c"....D.C..$'.W...h....o1%...p..5..wrkKw5.....E..R...1....y\.....>4.)....Q...x.Y"T...18x....z.$K.K.1...fX6..&t..............c.._F....@...t..{....V..vN\.T.$@.j7:|.1.Kh.tz.A}........`.y>.........`.......z....0\....Q....U.._?.l&..[..D..h`*.H9...........q....}FC]{'.....C...l{........qI........=........X.Ty0....Q....vW.'t.*Cx...l8.w.............}.B{;...:.....=F'... 4W~...:.._wx+.9.u .....A..P^..}.SQ..`+.....K.}...w......3.R.....=F...     /v ...(....m.4..a.^..[..a..yF... &.U`g...a.,!.8r,fZkE..J.[U;....x..S...+...LhA...=z.*=.M.../gk...f..#=......h$.c.....b>...9...f.rD..`?...Bq#.......M..=...jP....8X.%.....:....p-........h...S
20:10:37.161156 IP lamp-ubuntu-s-1vcpu-1gb-tor1-01.ssh > pool-99-228-153-224.cpe.net.cable.rogers.com.50332: Flags [P.], seq 5004:5776, ack 1, win 501, length 772
E..,.1@.@......-c........`.S*.S.P........D..{.B!......;..m.r......r....A./.q..!.x$....e.E.....=...;.^%}~&/.......3.j.7....1.......
..L#.c%6..Z....v.........Y.^%...n..$.m..5=...xQZ...hl.& e..,.../.Wet..f.0....!.nn=Ed....X~.<)%b..?$.Kz9.....&..Q.t.}.a...E....AE}.<"...........H.....=^V.J.....3;....].U..-of.)......'r[.Q.y....V.}.#aQ0...hg..... ..................   ...mFC'.x.o... zK.0..e.-....*$&U..........p?..%..... wD..s...R/.Q..B;.i...m.S.X@>l.xm....J.p...Ju......l.P.:.qhz..f..+..R.w1ao...jf`..v..-p.....K..V.....m.Bi.'2..N...>..<KH.1.....Zm..5..c..j.......o....,.    ........Z..).2.Tm.[..."..'lw@^..qQ]...V\1.....Q.Kx8.K.~..F..).....8.u...(6dR.m-.LV..|.4....akI/w....&.8O.....Y.6.O..W...e>..(Y9.e......I:...)E.P..      ..H}...".&.qB.E.2..<..:3.o..5.9....0.....y..,v. ........3.....`.m-..
..;<.....V...........Y,?.9..c.
20:10:37.178318 IP pool-99-228-153-224.cpe.net.cable.rogers.com.50332 > lamp-ubuntu-s-1vcpu-1gb-tor1-01.ssh: Flags [.], ack 5776, win 4106, length 0
E..(TC@.w...c......-....*.S..`.WP..
D9........
20:10:37.198711 IP lamp-ubuntu-s-1vcpu-1gb-tor1-01.47168 > 67.207.67.3.domain: Flags [.], ack 216, win 502, options [nop,nop,TS val 2269412484 ecr 1553160443], length 0
E..4..@.@.f....-C.C..@.5...e6.M.....%......
.D|.\.X.
20:10:37.229980 IP 2.57.122.189.58966 > lamp-ubuntu-s-1vcpu-1gb-tor1-01.ssh: Flags [P.], seq 68:136, ack 53, win 263, options [nop,nop,TS val 2275859552 ecr 2366369589], length 68
E..x..@.7.Q..9z....-.V..o..M..f*...........
...`...5...0`..5.....@%l..FU.c..jb.r(*...b.Z.#....x..d.;.....M..<...........
20:10:37.238200 IP lamp-ubuntu-s-1vcpu-1gb-tor1-01.ssh > 2.57.122.189.58966: Flags [P.], seq 53:105, ack 136, win 502, options [nop,nop,TS val 2366369724 ecr 2275859552], length 52
E..h    .@.@......-.9z....V..f*o..............
.......`... I.e.)...y.n.........m!...8.5.Y..`.*... 9w$G*...H
^Z
[2]+  Stopped                 tcpdump -A -i eth0
root@lamp-ubuntu-s-1vcpu-1gb-tor1-01:~#